company_name,domain,country,employee_count,source,raw_signal
Mistral AI,mistral.ai,France,1200,clay_export,"Hiring finance operations and workplace roles while expanding internationally across Europe and the United States; job posts mention global offsites and travel coordination."
DeepL,deepl.com,Germany,1000,clay_export,"Recent hiring for procurement and finance transformation roles; distributed offices in Europe and the US create cross-border travel and expense policy complexity."
Personio,personio.com,Germany,1800,clay_export,"Scaling teams across several European offices; job descriptions mention business travel, company events, and finance systems improvement."
Pleo,pleo.io,Denmark,900,clay_export,"Spend-management company with distributed teams; possible lower fit because they already solve expense workflows internally, but may still need travel and events management."
Wefox,wefox.com,Germany,700,clay_export,"Restructuring and unclear growth signal; some international offices but limited current evidence of travel or spend transformation urgency."
Typeform,typeform.com,Spain,450,clay_export,"Barcelona SaaS company hiring people operations and workplace roles; job posts reference hybrid teams, company events, and offsites."
Northstar Labs,northstarlabs.example,United States,80,manual_research,"Small startup with generic hiring signal and no clear travel, expense, invoice, or international expansion pain."
